Name,Event Description
ABINASHPUR SOCIAL WELFARE ASSOCIATE,health education and research employment training sanitation adolescents adults children healthcare workers medical practioners patients rural poor students urban women youth west bengal
Action Research and Training for Health society,health sanitation adolescents adults children elderly healthcare workers patients rural poor tribals women urban rajasthan
ALTERNATIVE FOR RURAL MOVEMENT,social services clothing other material assistance environment development and housing disaster emergency prevention control education research grassroots community organisations health sanitation mid day meals food distribution it consultancy agriculture welfare guidance activities for children adolescents adults dalits affected displaced persons domestic workers elderly farmers farm labourers firemen girl child healthcare hiv homeless rural poor street students volunteers women youth odisha
ASSOCIATION FOR SOCIAL HEALTH IN INDIA,social services grassroots community development organisations employment and training housing children girl child students women urban rural delhi
BHOJPUR MAHILA KALA KENDRA,social services education and research consultancy law advocacy politics clothing other material assistance recreation clubs homes for children disaster emergency prevention control employment training environment grassroots community development organisations health sanitation associations unions international manufacturing agriculture welfare guidance activities adolescents adults artisans dalits affected domestic workers elderly farmers farm labourers girl child homeless ngos orphans plants prisoners rural poor slum dwellers street students teachers urban volunteers weavers women youth bihar
Dalit Association for Social and Human Rights Awareness (DASHRA),social services grassroots community development organisations health sanitation education and research environment consultancy law advocacy politics clothing other material assistance collection purification distribution of water construction homes for children day care centres handicapped housing disaster emergency prevention control dramatic arts music activities employment training funeral related the aged associations unions international human rights peace transport libraries information archives architectural engineering technical manufacturing marriage bureaus mid meals food news media museums preservation historical sites nursing it protection animals birds professional recreation clubs recycling metal waste non refugee sporting agriculture travel tourists welfare guidance accident victims adolescents adults animal lovers armed forces artisans artists beggars blood donors chronically ill commercial sex workers dalits affected displaced persons domestic elderly ethnic groups factory farmers farm labourers firemen freedom fighters girl child healthcare hiv homeless juvenile legal lesbian gays bisexuals transgender medical practioners mentally challenged migrants ngos organ orphans patients physically plants policemen porters prisoners refugees rickshawallahs drivers rural poor salt scavengers slum dwellers sportspersons street students teachers tribals truckers urban volunteers war weavers women youth bihar
FACE (Foundation for Awareness Counselling and Education),education and research adults children girl child students women rural jharkhand
GOODWILL  FOUNDATION,social services environment development and housing disaster emergency prevention control education research grassroots community organisations health sanitation agriculture children farmers farm labourers juvenile rural poor students tribals urban women youth arunachal pradesh
Pragati Jubak Sangha,social services environment disaster emergency prevention and control health sanitation welfare guidance activities for children adolescents girl child physically challenged rural poor teachers women youth urban odisha
Pushp-kiran Union for Real Enlightenment (PURE),education and research employment training grassroots community development organisations health sanitation homes for children the handicapped law advocacy politics libraries information centres archives social services consultancy artisans beggars blood donors chronically ill construction workers dalits disaster affected displaced persons domestic elderly factory farmers farm labourers girl child homeless medical practioners ngos orphans patients physically challenged rickshawallahs drivers rural poor slum dwellers sportspersons street students teachers tribals urban volunteers weavers women youth delhi
SHRI VIGHNAHARTA SHIKSHAN KREEDA AND BAHUDDESHIYA SANSTHA,nan grassroots community development organisations accident victims adolescents adults animal lovers children commercial sex workers construction disaster affected displaced persons domestic elderly ethnic groups factory farmers farm labourers firemen freedom fighters girl child juvenile legal medical practioners migrants ngos organ donors patients physically challenged plants rural poor maharashtra
Social Entrepreneurs Foundation India,social services adolescents adults animal lovers artisans children commercial sex workers dalits domestic elderly farmers farm labourers girl child ngos rural poor slum dwellers street students urban women youth andhra pradesh
SOCIO ECONOMIC ALTERNATIVES RESEARCH AND RESOURCE COMMUNITY FOR HUMANITY,nan education and research law advocacy politics environment construction homes for children disaster emergency prevention control consultancy services grassroots community development organisations health sanitation employment training social housing agriculture adolescents adults dalits affected farmers farm labourers girl child orphans physically challenged rural poor street students tribals urban weavers women youth andhra pradesh
Supporting Association for Thematic and Holistic Initiatives (SATHI),social services health sanitation ngos rural poor students volunteers women youth uttar pradesh
"The Development on Communication, Arts & Culture, Science,Economic & Education Centre",social services health sanitation education and research law advocacy politics clothing other material assistance collection purification distribution of water environment construction disaster emergency prevention control recreation clubs homes for children development housing employment training grassroots community organisations the aged libraries information centres archives manufacturing mid day meals food nursing consultancy agriculture transport activities welfare guidance adolescents adults artists beggars blood donors affected displaced persons domestic workers elderly farmers farm labourers girl child healthcare hiv ngos orphans patients plants street students weavers women youth urban rural karnataka
BHAGWAN MANAV KALYAN SAMITI,social services education and research law advocacy politics employment training environment grassroots community development organisations health sanitation international human rights peace welfare guidance activities for children adults dalits farmers farm labourers girl child mentally challenged rural poor women youth uttar pradesh
CHARAK SWASTHYA BAHUUDHESIA SANSTHA,social services law advocacy and politics environment recreation clubs homes for children dramatic arts music other activities manufacturing marriage bureaus health sanitation consultancy education research agriculture adults animals birds artisans artists blood donors farmers farm labourers healthcare workers hiv juvenile legal mentally challenged plants rural poor sportspersons teachers women youth urban maharashtra
OSCAR(Organisation for Social Change Awareness and Responsibility) Foundation,education and research adolescents children girl child ngos students volunteers youth urban delhi
Rural Foundation,education and research environment construction homes for children employment training manufacturing mid day meals food distribution museums preservation of historical sites nursing it services health sanitation social development housing agriculture transport activities welfare guidance adults elderly farmers farm labourers girl child ngos rural poor street students teachers tribals volunteers women youth urban maharashtra
Sadvichar Parivar,social services health sanitation education and research grassroots community development organisations it adolescents adults children disaster affected domestic workers elderly girl child patients physically challenged students teachers urban poor women youth rural gujarat
Sakal Social Foundation,social services collection purification and distribution of water construction recreation clubs day care centres for handicapped disaster emergency prevention control dramatic arts music other activities education research health sanitation homes the libraries information archives news media adolescents adults artists blood donors children affected elderly farmers farm labourers girl child healthcare workers medical practioners orphans patients physically challenged plants policemen rural poor street students tribals urban volunteers women youth maharashtra
"SHABARI BAHUUDDEISHIYA MANDAL, SURWANI",social services construction employment and training environment education research homes for children the aged it sporting activities development housing welfare guidance accident victims adolescents adults animal lovers artisans beggars blood donors workers dalits domestic factory freedom fighters girl child healthcare hiv homeless mentally challenged migrants orphans patients physically plants porters volunteers war weavers women youth urban rural maharashtra
SONALI MAHILA VIKAS CHARITABLE TRUST,social services education and research welfare guidance activities for children adults artisans tribals weavers women youth urban rural gujarat
Access Life Assistance Foundation,health sanitation homes for children development and housing chronically ill urban rural maharashtra
AIDENT SOCIAL WELFARE ORGANISATION,health education and research sanitation consultancy services social welfare guidance activities for children adolescents adults commercial sex workers girl child healthcare hiv homeless juvenile migrants rural poor slum dwellers street students urban women youth bihar
ASSOCIATION FOR NEGLECTED GROUP AND EVANGELICAL LEADERSHIP,social services homes for children day care centres handicapped disaster emergency prevention and control education research employment training environment adolescents adults dalits affected farmers farm labourers girl child healthcare workers orphans patients physically challenged refugees rickshawallahs drivers rural poor slum dwellers street tribals urban women youth odisha
GRAMEEN VIKAS SANSTHA,health education and research grassroots community development organisations homes for the aged welfare guidance activities children adolescents adults artisans commercial sex workers elderly girl child hiv migrants patients urban rural uttar pradesh
International Rural Education & Cultural Association,education and research environment construction recreation social clubs homes for children development housing employment training grassroots community organisations health sanitation services adolescents girl child healthcare workers migrants ngos patients physically challenged rural poor street students tribals women youth gujarat
Jayavantrao Ghyar Patil Sevabhavi Sanstha,education and research health sanitation news media law advocacy politics environment employment training grassroots community development organisations consultancy services social agriculture adolescents adults animals birds children elderly farmers farm labourers rural poor students women youth urban maharashtra
LALITYA FOUNDATION,culture and recreation health sanitation homes for children the aged handicapped social services consultancy artisans artists beggars blood donors commercial sex workers construction disaster affected displaced persons elderly farmers farm labourers girl child hiv homeless ngos students youth urban rural maharashtra
MOTTO CHILDREN'S NEW WAY (NO MORE CHILD LABOURS AND BEGGARS FOREVER),social services education and research environment homes for children day care centres handicapped development housing welfare guidance activities beggars elderly farmers farm labourers freedom fighters girl child healthcare workers homeless juvenile mentally challenged orphans physically plants refugees rural poor slum dwellers street students tribals urban volunteers women youth tamil nadu
Root Institute for Wisdom Culture Charitable Trust,social services health sanitation activities of religious organisations recreation and clubs development housing libraries information centres archives education research protection for animals birds adolescents adults children chronically ill hiv patients rural poor bihar
Shree Bidada Sarvodaya Trust,health education and research employment training sanitation disaster emergency prevention control accident victims adolescents adults blood donors children chronically ill elderly girl child healthcare workers hiv juvenile medical practioners mentally challenged orphans patients physically rural poor street students urban war women youth gujarat
St. Xavier's Non-Formal Education Society,education and research law advocacy politics social services children construction workers dalits homeless legal migrants slum dwellers tribals urban poor volunteers women youth rural gujarat
The Young Citizen of India Charitable Trust,social services employment and training health sanitation adolescents farmers farm labourers girl child healthcare workers rural poor students teachers tribals urban volunteers women youth gujarat
AAJEEVIKA EDUCATIONAL TRAINING FOUNDATION,education and research employment training it services children construction workers domestic mentally challenged migrants ngos organ donors orphans patients plants rural poor students teachers tribals urban volunteers weavers women youth madhya pradesh
Action for Protection of Wild Animals(APOWA),environment disaster emergency prevention and control grassroots community development organisations agriculture protection activities for animals birds animal lovers artisans affected farmers farm labourers rural poor urban odisha
Bundel Khand Sewa Sansthan,social services environment disaster emergency prevention and control education research grassroots community development organisations international human rights peace law advocacy politics health sanitation agriculture adults blood donors children dalits affected farmers farm labourers girl child healthcare workers hiv homeless ngos plants rural poor students teachers tribals women youth madhya pradesh
CARING SOULS FOUNDATION,social services health sanitation healthcare workers hiv patients students teachers urban rural andhra pradesh
Centre for Development Education and Communications,education and research health sanitation consultancy services adults children elderly women urban rural tamil nadu
Centre for Development Service,social services disaster emergency prevention and control education research environment health sanitation agriculture adults children affected farmers farm labourers rural poor students tribals volunteers women youth odisha
Centre for Promotion of Social Concerns,social services law advocacy and politics adults children dalits disaster affected girl child legal workers medical practioners ngos physically challenged students teachers volunteers women youth urban rural tamil nadu
CHERRY BLOSSOMS SOCIETY,social services homes for children day care centres handicapped education and research the development housing adolescents elderly girl child mentally challenged ngos physically rural poor street students teachers volunteers women youth urban nagaland
Creation Welfare Society,social services environment employment and training agriculture adolescents adults dalits farmers farm labourers rural poor women youth urban bihar
END POVERTY,social services education and research environment recreation clubs employment training grassroots community development organisations libraries information centres archives agriculture consultancy adolescents adults artisans farmers farm labourers girl child ngos rural poor slum dwellers students tribals urban volunteers women youth bihar
Grameen Va Samajik Vikas Sanstha,social services accident victims adolescents adults animal lovers animals birds beggars children chronically ill construction workers dalits factory farmers farm labourers girl child juvenile migrants rural poor street urban volunteers women youth rajasthan
HOPE PUBLIC CHARITABLE TRUST(A unit of Social and Educational welfare trust),health homes for children the handicapped welfare and guidance activities mentally challenged urban rural tamil nadu
Ichapur BrahmanPara Silpa Niketan,social services education and research employment training environment health sanitation manufacturing adolescents adults children dalits elderly girl child hiv patients tribals women youth urban rural west bengal
ICHAPUR SOCIETY FOR THE WOMENS OWN IMAGE,social services environment adolescents children girl child healthcare workers ngos slum dwellers students tribals women youth urban rural west bengal
Institute of Social Development,social services environment grassroots community development organisations health sanitation adults animals birds children chronically ill elderly farmers farm labourers girl child healthcare workers hiv plants women youth urban rural uttarakhand
Jagabandhu Jarashram,social services consultancy grassroots community development organisations education and research homes for children day care centres handicapped disaster emergency prevention control environment health sanitation the aged international human rights peace protection activities animals birds recreation clubs recycling of non metal waste welfare guidance adults beggars blood donors dalits affected displaced persons elderly ethnic groups girl child healthcare workers hiv homeless juvenile mentally challenged migrants ngos organ orphans patients physically plants porters rickshawallahs drivers rural poor scavengers slum dwellers street students tribals urban volunteers war victims weavers women youth odisha
JEEVAN DEEP KALYAN SANSTHAN,social services consultancy children ngos salt workers rural bihar
MAHILA GRAMODYOG SEVA SAMITI,health law advocacy and politics sanitation adolescents adults children dalits girl child rural poor urban women youth uttar pradesh
Manthan The Achievement,social services recreation and clubs dramatic arts music other activities grassroots community development organisations health sanitation adults children girl child patients refugees rural poor slum dwellers students women youth urban west bengal
Midnapur Progressive SC/ST/ Minority Dev. Association,social services education and research homes for children environment health sanitation law advocacy politics dalits orphans physically challenged rural poor slum dwellers students tribals urban women west bengal
MODERN GRAMOUDHYOG SEWA SANSTHAN,social services ngos urban rural uttar pradesh
National Education Is Essential for Womens Society (NEEWS),health education and research law advocacy politics environment recreation social clubs disaster emergency prevention control employment training grassroots community development organisations sanitation agriculture welfare guidance activities for children adolescents adults girl child rural poor urban odisha
Pahal Initiative For Social Change Samiti,social services education and research disaster emergency prevention control homes for children grassroots community development organisations health sanitation adolescents beggars commercial sex workers girl child healthcare hiv juvenile mentally challenged migrants ngos orphans rural poor slum dwellers street students tribals urban volunteers women youth madhya pradesh
PARYAVARANA MITRA,environment law advocacy and politics disaster affected plants rural gujarat
Progati Sangha of Dara,social services construction homes for children education and research health sanitation adults dalits farmers farm labourers girl child homeless patients rural poor students women youth urban west bengal
Rural Educational Activities for Development,social services grassroots community development organisations education and research law advocacy politics clothing other material assistance environment construction disaster emergency prevention control recreation clubs housing employment training health sanitation homes for children the aged consultancy professional agriculture welfare guidance activities adolescents adults dalits affected domestic workers elderly ethnic groups farmers farm labourers girl child homeless migrants ngos orphans physically challenged plants rural poor slum dwellers street students tribals women youth urban odisha
SATYAKAM JAN KALYAN SAMITI,social services education and research employment training health sanitation adolescents adults children dalits elderly girl child rural poor tribals women youth madhya pradesh
Saurashtra Kamdar Kalyan Trust Rajkot,social services law advocacy and politics associations unions adults factory workers legal salt women youth urban rural gujarat
SGBS Unnati Foundation,social services employment and training consultancy adults girl child homeless orphans physically challenged rural poor slum dwellers students tribals urban women youth delhi
Shishu Sarothi (Centre for Rehabilitation & Training for Multiple Disability),social services health sanitation education and research homes for children day care centres handicapped employment training law advocacy politics consultancy adolescents adults chronically ill medical practioners physically challenged students women youth urban rural assam
"Shri  Nachiketa Kelvani Mandal, Devli",social services grassroots community development organisations education and research news media architectural engineering other technical activities environment consultancy business professional associations unions law advocacy politics clothing material assistance collection purification distribution of water construction health sanitation recreation clubs homes for children day care centres handicapped housing disaster emergency prevention control dramatic arts music employment training the aged international human rights peace manufacturing mid meals food sporting agriculture welfare guidance adults beggars blood donors commercial sex workers domestic farmers farm labourers girl child healthcare hiv homeless legal medical practioners migrants organ orphans patients physically challenged plants rural poor salt scavengers street students teachers truckers urban women youth gujarat
Shri Shah khimchand Lakshamichand Deaf and Dumb school trust,education and research homes for the handicapped health sanitation students urban rural gujarat
Society for Harmonious Renaissance of Ideas through Simple Technological Initiatives (SHRISTI),social services grassroots community development organisations tribals rural odisha
"The Action Northeast Trust (""the ant"")",social services law advocacy and politics disaster emergency prevention control grassroots community development organisations education research health sanitation agriculture welfare guidance activities for children adolescents adults affected displaced persons ethnic groups farmers farm labourers girl child healthcare workers homeless juvenile mentally challenged ngos rural poor students teachers tribals weavers women youth assam
The Sacred Heart Brothers,social services education and research construction homes for children development housing employment training environment grassroots community organisations health sanitation agriculture adolescents adults workers dalits domestic migrants rural poor slum dwellers street students teachers tribals urban women youth andhra pradesh
Vasundara Charitable Trust,social services dramatic arts music and other activities employment training development housing adults artisans artists beggars children disaster affected farmers farm labourers girl child hiv mentally challenged orphans physically street students teachers women youth urban rural andhra pradesh
WELDON TRUST,social services education and research recreation clubs homes for children day care centres handicapped disaster emergency prevention control employment training environment health sanitation grassroots community development organisations the aged housing consultancy adolescents blood donors dalits affected farmers farm labourers girl child healthcare workers hiv medical practioners mentally challenged physically rural poor street students tribals truckers volunteers women youth urban puducherry
AADHAR BAHUUDESHIYA SEVA BHAVI SANSTHA AURANGABAD,social services adults children urban rural maharashtra
ADARSH GRAMODYOG VIKAS SANSTHAN,social services environment grassroots community development organisations health sanitation employment and training education research it adolescents adults children farmers farm labourers students volunteers women youth urban rural uttar pradesh
