Name,Description
SCHEDULED CASTE WELFARE CENTRE,social services urban rural all india adults
Seali Hrishikesh Smriti Pathagar,education and research urban rural west bengal adults children
Selagamsetty Charitable Trust (SCT),social services urban rural all india adults
SELOO TALUKA GRAMIN ADIWASI VIKAS SANSTHA,social services urban rural maharashtra adults children elderly girl child healthcare workers hiv tribals women youth
SERVE & HELP CHARITABLE TRUST (SHCT),social services urban rural odisha children homeless juvenile orphans plants street children
SERVMANGLAM A WELFARE SOCIETY FOR ALL,social services urban rural delhi adults children elderly girl child women youth
Seven Pillars Foundation Trust (SPF) A Developmental and Non-Profitable Trust,health urban rural all india adolescents adults
SHIKSHA PRASAR EVAM KALYAN SAMITI,social services urban rural uttarakhand adults children
Shri Ashtavinayak Shaishanik Va Sanskrutik Mandal,social services urban rural maharashtra women youth
SHRI DIVYAJYOTI GRAM VIKAS KELAVANI MANDAL,social services rural gujarat adults children elderly women youth
SHRI GANESH BAHUUDDESHIYA SANSTHA,social services rural maharashtra adults
Shri Sant Chokhoba Shikshan Prasarak Mandal,social services rural maharashtra adults children dalits elderly farmers farm labourers women youth
Shrigadi Foundation,social services urban rural maharashtra students women youth
SHRIKRUSHNA BAHUUDDHESHIYA GRAMIN VIKAS SANSTHA,social services urban rural maharashtra adults children elderly women youth
SIDDHANT EDUCATION & RESEARCH FOUNDATION,social services urban rural himachal pradesh accident victims adolescents adults artisans artists beggars children displaced persons domestic workers elderly farmers farm labourers freedom fighters girl child homeless juvenile legal workers lesbian gays bisexuals transgender migrants ngos orphans patients plants prisoners rural poor sportspersons street children students teachers tribals urban poor volunteers war victims women youth
Smruti Gramin Adivasi Vikas Bahuddeshiya Sevabhavi Sanstha,social services urban rural maharashtra adults children elderly girl child women youth
SMT PARVATIBAI TULSHIRAM GARUD SAMAJIK SHAISHANIK SANSKRUTIK KALA KRIDA SANSTHA,culture and recreation urban rural maharashtra children dalits farmers farm labourers girl child migrants ngos physically challenged slum dwellers street children students urban poor weavers women youth
Social Research & Implementation Institute(SRII),social services urban rural odisha adolescents adults children dalits displaced persons elderly farmers farm labourers girl child hiv mentally challenged migrants patients rural poor slum dwellers street children students tribals urban poor volunteers women youth
SOCIETY FOR EXPEDITING VOLUNTARY ACTIONS(SEVA),social services rural odisha adults children elderly women youth
SOCIETY FOR RATIONAL DEVELOPMENT,social services urban rural rajasthan adults animal lovers artists children elderly rural poor sportspersons
SOCIO ECONOMIC REFORMS BY VOLUNTARY EFFORTS,social services urban rural west bengal adults children elderly students women youth
SONARPUR SWAMI VIVEKANANDA MANAS MISSION,social services urban rural west bengal adolescents adults beggars blood donors children elderly girl child healthcare workers medical practioners mentally challenged patients physically challenged rickshawallahs drivers rural poor street children students women youth
Sparsh Foundation,social services rural maharashtra adults children elderly girl child women youth
Special Care Organization for Physically Exceptional,social services urban rural west bengal adults children elderly women youth
SPREAD (SOCIETY FOR PEACE RURAL EDUCATION AND AWARENESS DEVELOPMENT) SOCIETY,social services urban rural andhra pradesh adults children
SRI NRUSINGHA DEV ANCHALIKA YUBA PARISADA,social services urban rural odisha children disaster affected girl child healthcare workers mentally challenged physically challenged rural poor slum dwellers street children students teachers volunteers women youth
SUJATA MAGHASWARGIYA MAHILA MANDAL,education and research urban rural all india adolescents adults animal lovers animals birds armed forces artisans artists beggars blood donors children chronically ill commercial sex workers construction workers dalits disaster affected displaced persons domestic workers elderly ethnic groups factory workers farmers farm labourers firemen freedom fighters girl child healthcare workers hiv homeless juvenile legal workers lesbian gays bisexuals transgender medical practioners mentally challenged migrants ngos organ donors orphans patients physically challenged plants policemen porters prisoners refugees rickshawallahs drivers rural poor salt workers scavengers human slum dwellers sportspersons street children students teachers tribals truckers urban poor volunteers war victims weavers women youth
SURI DEEP SOCIETY,education and research urban rural west bengal artisans healthcare workers ngos students women youth
Sustainable Development Organization,environment rural all india accident victims adults
Swa Nandabai Kirdak Bahuuddheshiya Sanstha,social services urban rural maharashtra adults girl child women youth
Swa Vithobaji Giradkar Smruti Bahuuddeshiya Seva Sanstha Nagpur,social services urban rural maharashtra adults children farmers farm labourers street children students youth
SWAMI VIVEKANANDA LALIT KALA VA KRIDA MANDAL,social services urban rural maharashtra adults children elderly women youth
SWAMI VIVEKANANDA MISSION TRUST,social services rural west bengal accident victims adolescents animal lovers artisans artists beggars blood donors children disaster affected displaced persons domestic workers elderly farmers farm labourers girl child healthcare workers hiv legal workers ngos orphans patients physically challenged plants rural poor street children students volunteers women youth
SWAMIJI JANAKALYAN SANGSTHA,social services urban rural tripura adults children women youth
Swarajya Gramin Vikas Pratisthan,social services rural maharashtra children girl child healthcare workers students
SWARGIYA SMT LALITA DEVI SHIKSHA SEWA SANSTHAN,social services rural all india rural poor
SWASTIK TRUST,social services urban rural tamil nadu adults children students
SWAYAMBHAR NARI,social services rural west bengal adolescents adults children rural poor women
TALENTED ASPIRANTS PEOPLE'S ACTION FOR THE SOCIETY FOR VIGOROUS INN (TAPASVI),social services urban rural andhra pradesh adults blood donors children elderly farmers farm labourers girl child homeless juvenile mentally challenged ngos orphans plants street children students teachers tribals urban poor volunteers women youth
THALASSEMIA AND AIDS PREVENTIVE FOUNDATION,health urban rural west bengal hiv 
"The Association for Leprosy Education, Rehabilitation and Treatment - India",health urban rural maharashtra adolescents adults children chronically ill commercial sex workers construction workers dalits displaced persons elderly ethnic groups factory workers farmers farm labourers girl child healthcare workers hiv medical practioners migrants ngos patients physically challenged rickshawallahs drivers rural poor slum dwellers students teachers tribals truckers urban poor volunteers women youth
THE SATKAARYA TRUST,social services urban tamil nadu children girl child homeless orphans
TRIGYA BUDDHIST MULTIPURPOSE FOUNDATION,social services urban rural maharashtra adults children women youth
TULJAI BAHUUDESHIYA SANSTHA MEHRUN JALGAON,social services urban rural maharashtra adults girl child women youth
Udan Multipurpose Foundation,social services urban rural maharashtra adults women youth
UJJIBAN 03,social services urban rural bihar adolescents artisans beggars children disaster affected domestic workers elderly farmers farm labourers girl child homeless patients physically challenged rural poor slum dwellers students teachers tribals urban poor women youth
UMANG BAHUUDDESHIYA SANSTHA,social services urban rural maharashtra adults children elderly women youth
UNIQUE WOMEN DEVELOPMENT AND MULTIPURPOSE SOCIETY HINGOLI,social services urban rural maharashtra animals birds beggars blood donors children dalits domestic workers girl child healthcare workers hiv homeless juvenile legal workers lesbian gays bisexuals transgender orphans patients plants sportspersons urban poor volunteers women youth
UNIQUEE FOUNDATION,social services urban rural karnataka accident victims adults beggars blood donors children construction workers dalits disaster affected displaced persons domestic workers elderly factory workers farmers farm labourers freedom fighters girl child healthcare workers homeless juvenile legal workers medical practioners mentally challenged ngos organ donors orphans patients physically challenged plants policemen rickshawallahs drivers
V HELP WELFARE SOCIETY,social services urban rural all india adults children girl child women youth
VANAVIL SOCIAL WELFARE DEVELOPMENT TRUST,social services rural tamil nadu disaster affected hiv mentally challenged orphans physically challenged students women
VANSH SHIKSHAN PRASARAK SANSTHA,education and research rural maharashtra children girl child students youth
Verbattle Foundation,education and research urban rural all india adolescents adults children students teachers youth
Vidya Vikas Mandal,social services urban rural maharashtra adults children elderly women youth
VISHWAJEET SAMRAT ASHOKA CHARITABLE TRUST,health urban rural maharashtra adults children chronically ill elderly healthcare workers hiv patients women youth
Voluntary Action for Rural and Social Activities ( VARSA ),social services urban rural all india adults children
VOLUNTARY ASSOCIATION FOR RURAL UPLIFTMENT AND NETWORKING (VARUN),social services rural uttar pradesh adults children women youth
Wajood Foundation,social services urban rural maharashtra adults elderly girl child women youth
WHATSMORE FOUNDATION,social services urban rural all india adolescents adults animals birds artisans artists children dalits factory workers farmers farm labourers freedom fighters girl child healthcare workers hiv ngos urban poor volunteers women youth
WOMEN'S ORGANISATION FOR RURAL DEVELOPMENT (WORD),social services rural odisha adolescents adults children dalits elderly farmers farm labourers girl child healthcare workers migrants rural poor street children students tribals women youth
YUVA PRAVARTANA,education and research urban rural all india children construction workers elderly ethnic groups factory workers medical practioners ngos policemen rural poor students teachers youth
ZEN SHIKSHAN PRASARAK MANDAL,education and research urban rural maharashtra adults blood donors children farmers farm labourers girl child healthcare workers legal workers ngos rickshawallahs drivers students teachers tribals urban poor volunteers war victims women youth
IRADA FOUNDATION (INDIAN RURAL AWARENESS & DEVELOPMENT ACTION),social services urban rural uttar pradesh adolescents artisans children construction workers dalits farmers farm labourers girl child healthcare workers hiv homeless juvenile mentally challenged migrants physically challenged plants rural poor students tribals women youth
AASARE SAMAJ SEVA SANSTH?A,social services urban rural karnataka adults
AASTHA REFORMER-RAJKOT,social services urban rural gujarat adults children women youth
AGNUS GANJA BOJEXIO SOCIAL SERVICE SOCIETY,education and research urban rural andhra pradesh adults children elderly women youth
AKSHARA CHAITHANYA INTEGRATED MODEL SOCIETY,education and research urban rural all india accident victims adolescents adults blood donors children disaster affected displaced persons domestic workers farmers farm labourers girl child healthcare workers hiv homeless medical practioners mentally challenged migrants ngos orphans patients physically challenged plants rural poor slum dwellers street children students tribals urban poor volunteers women youth
ALFAAZ Education and Cultural Society,education and research urban all india adults ngos students teachers volunteers women youth
ALIPURDUAR RURAL & TRIBAL DEVELOPMENT KALLYAN SAMITI,social services urban rural west bengal adults children
ALL INDIA WOMEN'S CONFERENCE BOMBAY BRANCH,social services urban rural maharashtra adults children girl child street children women
ALL PROFESSIONAL & EDUCATIONAL WELFARE SOCIETY,education and research urban rural all india adolescents
ALOK SANGHA,social services urban rural west bengal artisans artists healthcare workers plants rural poor women youth
Alternative Futures,social services urban rural all india adults women youth
Anchalik Samrudhi Sadhana Anusthan,social services urban rural odisha adults
Annabhau Sathe Magaswargiya Sevabhavi Sanstha,social services urban rural maharashtra adults children elderly women youth
Annapurna Sevabhavi Sanstha,social services urban rural maharashtra women youth
AREA NETWORKING AND DEVELOPMENT INITIATIVES-ANANDI,social services urban rural all india adults
ARPHEN (Association Of Rural People for Health and Educational Needs),social services urban rural maharashtra adults children chronically ill elderly women youth
Ashwamedh Magaswargiya Shikshan Sanstha,social services urban rural maharashtra adults women youth
ASRA FOUNDATION,social services urban rural maharashtra adults children girl child rural poor women youth
AYOD VIKAS SOCIETY,social services urban rural jharkhand rural poor
Baba Ram Karan Das Gramin Vikas Samiti,social services urban rural uttar pradesh children elderly women youth
Bartimaeus Society For The Blind,social services urban rural karnataka children girl child healthcare workers medical practioners orphans patients students women youth
BASTI AREA DEVELOPMENT COUNCIL,social services urban rural odisha children women youth
BHABNA ASSOCIATION FOR PEOPLES UPLIFTMENT,social services urban rural all india adults
BIHANG WELFARE ASSOCIATION,education and research urban rural all india adolescents adults animal lovers animals birds artisans artists blood donors children chronically ill commercial sex workers dalits disaster affected displaced persons domestic workers elderly girl child healthcare workers hiv legal workers medical practioners migrants ngos patients physically challenged plants rickshawallahs drivers rural poor slum dwellers sportspersons street children students teachers tribals volunteers weavers women youth
BNM - TSK TRUST,education and research rural tamil nadu adolescents adults children girl child rural poor students volunteers women youth
Bolpur Manab Jamin,social services urban rural west bengal adults
BUNIYAD NEW DEVELOPMENT YOUTH ORGANISATION WARASEONI,social services urban rural all india youth
Care For Society,social services urban rural all india adults children commercial sex workers disaster affected elderly girl child hiv homeless mentally challenged migrants ngos organ donors orphans patients physically challenged plants rickshawallahs drivers rural poor slum dwellers students tribals volunteers women youth
Centre for Social Reconstruction,social services urban rural tamil nadu adults children commercial sex workers farmers farm labourers girl child hiv ngos rural poor students tribals women youth
Chaltaberia Gana Unnayan Sangstha,social services urban rural west bengal animal lovers animals birds artisans artists children disaster affected elderly ethnic groups tribals women youth
CHILDREN OF MOTHER EARTH,social services urban rural uttar pradesh children
CREATIVE ACTION FOR POOR (CAP),social services urban rural jharkhand children elderly students women youth
DEVELOPMENT EDUCATION AND CHARITABLE TRUST -RAJKOT,social services urban rural gujarat adults
DEVELOPMENT INNOVATION FOUNDATION,education and research urban rural bihar adolescents adults artisans dalits disaster affected elderly ethnic groups farmers farm labourers girl child hiv homeless migrants ngos rural poor salt workers weavers women youth
DHYEY FOUNDATION,social services urban rural all india adults
Divyashakti Yogpith (Akhada),social services urban rural maharashtra adults women youth
"DNYANPEETH SARVJANIK VACHNALAY,PANDHARKAWADA",social services urban rural maharashtra adolescents adults children girl child orphans street children students women youth
EARTH CARE,social services urban rural west bengal artisans artists children dalits disaster affected elderly healthcare workers hiv students women youth
Ek Prayaas Educational Society,education and research urban west bengal children girl child street children volunteers
"EKVIRA MULTIPURPOSE FOUNDATION, AKOLA",education and research urban rural maharashtra adults children physically challenged women
Environmental Studies and Rural Development Society,social services urban rural uttar pradesh animal lovers animals birds plants rural poor tribals volunteers women
GANDHIAN ACTION FOR RURAL DEVELOPMENT (GARD),social services urban rural all india adults
GLOBAL AGRICULTURE RURAL DEVELOPMENT EDUCATION SANSTHAN,social services urban rural uttar pradesh adults children elderly farmers farm labourers girl child students women youth
GRAM SATHI,social services urban rural bihar adults children
Gramin Lok Kalyan va Shikshan Sanstha Aurangabad,education and research urban rural maharashtra adolescents adults dalits farmers farm labourers hiv volunteers women
Gramin Sakshmikaran Bahuudeshiya Vikas Sanstha,social services urban rural maharashtra dalits tribals
GRAMIN SAMAJ KALYAN SANSTHAN,social services rural bihar adults animal lovers animals birds artisans artists beggars children dalits disaster affected elderly ethnic groups farmers farm labourers healthcare workers hiv rural poor street children students tribals
Gramin Samajik Vikas Samiti-Barh,social services urban rural bihar adolescents adults
GURUDATTA SHIKSHAN PRASARAK MANDAL,education and research rural maharashtra children girl child orphans rural poor street children students
GURUDEV FOUNDATION WASHIM,education and research urban rural maharashtra adults artisans artists blood donors children commercial sex workers dalits domestic workers farmers farm labourers girl child hiv homeless juvenile legal workers medical practioners ngos orphans policemen prisoners rural poor street children students teachers tribals urban poor women youth
GYAN SWAROOP WELFARE SOCIETY,social services urban rural all india adults
HARINGHATA SAPHALYA DEVELOPMENT SOCIETY,social services urban rural west bengal adults children dalits farmers farm labourers girl child healthcare workers plants students tribals women youth
HEALTH & ECO DEFENCE - SOCIETY,social services urban rural all india adults
Hill People's Development Council,social services urban rural manipur children youth
Hind Hope Society,social services urban rural rajasthan beggars children dalits elderly girl child mentally challenged physically challenged women youth
Howrah Suparna,social services urban rural west bengal children women youth
HUBRAJI JAN KALYAN SAMITI,social services urban rural uttar pradesh children healthcare workers students women
INDIAN PROGRESSIVE YOUTH FORUM,social services urban rural uttar pradesh accident victims adolescents adults animal lovers farmers farm labourers healthcare workers mentally challenged rural poor street children students urban poor volunteers women youth
Institute of Social Research and Development,social services urban rural all india adults
INSTITUTIONAL EXCELLENCE FORUM,education and research urban rural all india girl child students teachers youth
Jagriti Seva Sansthan,social services urban rural uttar pradesh children girl child women youth
Jagrook Mahila Sanstha Parcham,social services rural uttar pradesh adults
Jai Narayan Sarvodaya Vidyalaya Samiti,social services urban rural madhya pradesh adults
JAN ASTHA,social services rural jharkhand dalits disaster affected farmers farm labourers
Jan Sahyog Sewa Kendra,social services urban rural jharkhand adults
Jan Shikshan Sansthan,education and research urban rural maharashtra adolescents adults artists blood donors children construction workers dalits domestic workers factory workers farmers farm labourers healthcare workers hiv ngos orphans rickshawallahs drivers rural poor scavengers human slum dwellers street children students teachers tribals urban poor women youth
Jan Uththan Development Research Foundation,social services urban rural gujarat adults
Janmangal Sansthan M P,social services urban rural all india adults
JEEVAN GYAN TRUST,education and research urban rural all india adults girl child
JEEVAN VIKAS SANSTHA PAITHAN,health rural maharashtra accident victims adolescents adults animal lovers children elderly women youth
JEEVANDHARA BAHUUDDESHIY SANSTHA,social services urban rural maharashtra accident victims adolescents adults animal lovers animals birds armed forces artisans artists beggars blood donors children chronically ill commercial sex workers construction workers dalits disaster affected displaced persons domestic workers elderly ethnic groups factory workers farmers farm labourers firemen freedom fighters girl child healthcare workers hiv homeless juvenile legal workers lesbian gays bisexuals transgender medical practioners mentally challenged migrants ngos organ donors orphans patients physically challenged plants policemen porters refugees rickshawallahs drivers rural poor scavengers human slum dwellers sportspersons street children students teachers tribals truckers urban poor volunteers weavers women youth
JIBAN BIKASH,social services urban rural odisha adults children women youth
Jyot Bahuudeshya Samajik Sanstha,social services urban rural maharashtra adults women youth
KADAMBARI WELFARE SOCIETY,social services urban rural all india adults
Kai.Sau.Kusumbai Balkrushna Wani Sarvajanik Vachanalay,social services rural maharashtra adults artists elderly girl child students women youth
Kala Bikash Parishad,social services urban rural odisha adults women youth
Kalyani Life Institute,education and research urban rural west bengal children mentally challenged physically challenged urban poor
Kamta Cyclone Club,social services urban rural west bengal adults children women youth
KARMAWATI PAL MEMORIAL SOCIETY,social services urban rural uttar pradesh adolescents adults women youth
Kartavya Shikshan Va Sewa Samiti,social services urban rural all india children students youth
KAUSHIKI FOUNDATION,social services rural jharkhand children dalits elderly farmers farm labourers physically challenged
KOKAN INTERNATIONAL,education and research rural maharashtra adults children rural poor women youth
KOLKATA SHILPOBHUMI,culture and recreation urban rural west bengal adults
Koshish Foundation,social services urban rural gujarat adults children women youth
Kuzhithurai Integral Development Social Services Trust,social services urban rural tamil nadu adolescents adults artisans children dalits disaster affected displaced persons domestic workers elderly farmers farm labourers healthcare workers mentally challenged migrants physically challenged rural poor urban poor women youth
Ladakh Educational and Social Development Organisation,social services urban rural jammu and kashmir adolescents women youth
LANTERN CHARITABLE TRUST,social services urban rural all india accident victims adolescents adults animal lovers animals birds blood donors children commercial sex workers construction workers dalits disaster affected displaced persons domestic workers elderly ethnic groups factory workers farmers farm labourers girl child healthcare workers hiv homeless juvenile legal workers mentally challenged migrants ngos organ donors orphans patients physically challenged plants rural poor street children students tribals truckers urban poor volunteers women youth
LOK KALYAN JAN SABHA,social services urban rural all india adults
Lok Shahir Annabhau Sathe Sanskratik Natya Mandal,social services urban rural maharashtra adults artisans artists children girl child women youth
LOK VIKAS SAMITI,social services urban rural rajasthan adults
LOKRAJYA SAMAJ VIKAS VA SANSHODHAN SANSTHAN AURANGABAD,social services urban rural maharashtra adults
Maa Sharda Bahuuddeshiya Association,education and research urban rural maharashtra children dalits girl child hiv street children students women youth
MAHAMAYA SHIKSHA EVAM SAMAJ KALYAN SAMITI,social services urban rural madhya pradesh children students
MAHILA UTTHAN,social services urban rural uttar pradesh women
MAHILA VA BAL VIKAS BAHUDDESHIYA SEVABHAVI SAMAJIK SANSTHA,social services urban rural maharashtra children girl child women
Mahila Vikas Va Shishu Sanskar Kendra,social services urban rural maharashtra children women
MAHILAEN PRAGATI KI ORE,social services urban rural delhi women
"Markaz-E-Adab-O-Science (Centre for Literature, Comparative Religion, Career Guidance and Training)",social services urban rural jharkhand adolescents adults women youth
MASTER WELFARE ASSOCIATION RAJURA,social services urban rural all india adults
MATOSHRI SEVA PRATISHTHAN GANGAKHED,social services urban rural maharashtra adults children
Midnapore Cultural and Welfare Association,social services rural west bengal artisans children farmers farm labourers plants tribals women youth
Mission Heal,social services urban rural all india children women
Mission Smile,health urban rural west bengal adolescents adults children
Mokshda Paryavaran Evam Van Suraksha Samiti,social services urban rural all india plants
Mother Concern,social services urban rural all india women
MUHAMMADIYA EDUCATIONAL AND CHARITABLE TRUST,education and research rural maharashtra children street children students
Mukti Niketan Bhagalpur,social services urban rural bihar adults children
NABAJYOTI CHARITABLE TRUST,social services urban rural odisha adults children elderly women youth
NAG FOUNDATION,health urban rural maharashtra patients
Narendra Gramin Vikas Sansthan,social services urban rural uttar pradesh women
