Name,Description
Swarajya MitraSamajik Sanstha,social services urban rural maharashtra adults children women youth
"TAGORE FOUNDATION SCHOOL, KOLKATA",social services urban rural west bengal adults children women youth
THE HELP,social services rural odisha children disaster affected farmers farm labourers migrants rural poor tribals women youth
The Live Love Laugh Foundation,health urban rural all india adolescents adults elderly medical practioners mentally challenged students teachers women youth
"THE NATIONAL EDUCATION SOCIETY, SIRGAON, TA: UMARGAON",social services urban rural gujarat adults women youth
The Sirri Saqti Foundation,social services urban rural bihar adults
THIRU VIVILIA ANDAVAR ATHMEEKA ILLAM,social services urban rural tamil nadu adults women youth
Tuljabhawani Shikshan Prasarak Sanstha,social services urban rural maharashtra adults women youth
Tulsi Eye Hospital,health urban rural maharashtra beggars commercial sex workers construction workers dalits domestic workers factory workers farmers farm labourers patients physically challenged rickshawallahs drivers rural poor scavengers human slum dwellers tribals truckers
UPKAR,social services rural odisha adults
USHADEVI PATHAGAR,social services urban rural odisha adults
Utakal Vikas,social services urban rural odisha adults
Utkal Bidyarthi Abhijana (UBA),social services urban rural odisha adults women youth
UTKAL JANA SEVA SAMITI,social services urban rural odisha adults
VASUNDHARA FOUNDATION,social services urban rural maharashtra adults women youth
VISHWAS DYAN PRABODHINI & RESEARCH INSTITUTE,education and research urban rural maharashtra adolescents children dalits girl child ngos rural poor slum dwellers sportspersons street children students teachers tribals urban poor volunteers women youth
Youth 4 Jobs Foundation,education and research urban rural telangana physically challenged students teachers youth
YOUTH RURAL DEVELOPMENT,social services urban rural odisha students youth
Zav Foundation,social services urban rural karnataka adults children girl child women youth
AADHAAR SEVA SANGH,social services rural maharashtra students women
Aashraydurg Bahuuddeshiy Samajik Sanstha,social services urban rural maharashtra adolescents adults children dalits disaster affected domestic workers elderly farmers farm labourers orphans patients physically challenged rural poor slum dwellers students tribals urban poor women youth
ABHILASHA SAMAJIK SANSTHAN,social services urban rural all india adults children women youth
ABHIVRUDHI FOUNDATION,social services urban rural karnataka children patients students women youth
ABHYUDAYA,environment rural odisha adolescents dalits farmers farm labourers plants students women youth
ACTION IN DISABILITIES INDIA (AID INDIA),social services urban rural tamil nadu children dalits girl child homeless juvenile mentally challenged orphans physically challenged refugees rural poor students teachers volunteers women youth
ADARSH CHETNA MANCH,social services urban rural bihar adults
Adarsh,social services urban rural bihar adults
ADARSHA CHARITABLE TRUST,education and research urban rural andhra pradesh adolescents artisans artists blood donors children dalits disaster affected displaced persons elderly farmers farm labourers girl child homeless medical practioners mentally challenged migrants ngos orphans patients physically challenged rural poor scavengers human street children students teachers tribals urban poor volunteers women youth
ADARSHA YUBAK SANGHA,social services urban rural odisha youth
AHMADPUR SPORTS COMPLEX,social services urban rural west bengal children sportspersons students women youth
AMRUT DHARA,social services urban rural odisha adults
ARANYAKA,social services urban rural odisha adolescents adults
ARUN NAGAR BELPUKU MATH VIVAKANANDO STUDY ACADEMY,social services urban rural west bengal adults children
ASIAN EDUCATIONAL RESEARCH & DEVELOPMENT PROGRAMME SOCIETY,social services urban rural rajasthan artisans artists children
BABU NAGENDRA SINGH SEWA SANSTHAN,social services urban rural uttar pradesh adults children women youth
BAITARANI,social services urban rural odisha adults
BAPU BAL VIKAS MAHILA KALYAN SOCIETY,social services rural all india adults children rural poor
Batika,social services urban rural bihar adults
"BODHISATWA DR. BABASAHEB AMBEDKAR SANSKRUTIK MANDAL, NAVIN SUBHEDAR NAGAR, NAGPUR",social services urban rural maharashtra adults
Bolpur Ukilpatty Suchetana,social services urban rural all india adolescents adults artisans artists children dalits domestic workers elderly girl child homeless ngos physically challenged rural poor slum dwellers street children students tribals urban poor women youth
CAUSELESS HAPPINESS ORGANISATION,social services urban rural all india blood donors children girl child hiv homeless mentally challenged orphans patients physically challenged women
CENTRE FOR REHABILITATION SERVICES AND RESEARCH (CRSR),social services urban rural odisha adults children women youth
CHAITANYA RURAL DEVELOPMENT SOCIETY,social services urban rural all india adolescents adults children commercial sex workers dalits domestic workers girl child hiv mentally challenged migrants orphans rural poor slum dwellers street children students
CHHATTISGARH PRADESH YOUTH FOUNDATION FOR HUMAN DEVELOPMENT,social services urban rural chhattisgarh adults children dalits elderly ethnic groups girl child plants students teachers women youth
CHILD HEART FOUNDATION,social services urban rural delhi children girl child orphans
COMMUNITY AWARENESS & VILLAGE IMPROVEMENT,social services urban rural andhra pradesh adults blood donors children dalits elderly farmers farm labourers girl child healthcare workers hiv juvenile orphans patients physically challenged women youth
Deepayan,social services urban rural bihar adults
DIVYA KIRAN SEWA SANSTHAN,social services urban rural rajasthan children plants women
DRONAGIRI SHIKSHAN SANSTHA,social services rural maharashtra children orphans
GREEN FUTURE FOUNDATION,environment urban rural delhi animal lovers animals birds farmers farm labourers plants
GYAAN NIKETAN FOUNDATION,education and research urban rural maharashtra children construction workers girl child students
Harijan Adiwasi Shikshan Prashikshan Kalyan Sansthan,health rural bihar accident victims adolescents adults blood donors children commercial sex workers construction workers dalits disaster affected domestic workers farmers farm labourers girl child healthcare workers hiv migrants ngos physically challenged refugees rickshawallahs drivers rural poor street children students teachers truckers urban poor volunteers women youth
HEALTHY INDIA FOUNDATION,health urban rural odisha adults children chronically ill elderly patients women youth
HIFAZAT,social services urban rural bihar adults
HOPE ONE WELFARE SOCIETY,social services rural delhi children women
Humanitarian Aid International,social services urban rural all india accident victims disaster affected displaced persons farmers farm labourers migrants ngos organ donors refugees rural poor urban poor
JAGO YUVA MANDAL SANSTHAN,social services urban rural rajasthan ngos
JANA KALYAN SAMITEE,education and research urban rural odisha adults children farmers farm labourers girl child healthcare workers scavengers human students teachers tribals volunteers women youth
Jharkhand Jyoti,social services urban rural jharkhand adults
KALASHREE SANSAD,education and research urban rural odisha artists children dalits girl child physically challenged students teachers women youth
KULPI LIFE BRIDGE FOUNDATION,social services urban rural west bengal adults children elderly women youth
LABOUR EMPLOYMENT AND ENVIRONMENT DEVELOPMENT COUNCIL,social services urban rural all india children factory workers firemen healthcare workers ngos students
Lalgarh Chetak Seva Samity,social services urban rural west bengal women
LAW AND RIGHTS COUNCIL OF INDIA,social services urban rural maharashtra adults women youth
Learning Curve Life Skills Foundation,social services urban rural telangana children
"MAHALAXMI SHIKSHAN, SANSKRUTIK, KRIDA VA WACHNALAY PRASARAK MANDAL",culture and recreation urban rural maharashtra students urban poor women youth
Makkala Jagriti,social services urban rural karnataka children
Malhar Janseva Foundation,social services rural maharashtra children women youth
MANAVA ADHIKAR SEVA SAMITI,social services urban rural odisha adults children youth
MEEHRA TAILORING TRAINING CENTER,social services rural tamil nadu girl child women
MUHEEM,social services urban rural jharkhand adults
NARAYAN MEMORIAL FOUNDATION TRUST (N.M.F.T),social services rural odisha adults children elderly girl child women youth
NARENDRAPUR HOPE HOUSE FOUNDATION,social services urban rural west bengal adults blood donors children disaster affected elderly farmers farm labourers girl child healthcare workers hiv homeless mentally challenged ngos physically challenged plants rural poor street children students volunteers women youth
Nari Pragati Niketan,social services rural uttar pradesh girl child women
NATADHA,social services urban rural west bengal adults
NATIONAL INSTITUTE OF TECHNOLOGY AND MANAGEMENT TRUST,education and research urban rural all india accident victims adolescents adults animal lovers displaced persons domestic workers hiv homeless lesbian gays bisexuals transgender mentally challenged ngos refugees rickshawallahs drivers rural poor salt workers students teachers
ORISSA PRADESH ADIVASI VIKASA PARISHAD,social services rural odisha dalits rural poor tribals
Palli,social services urban rural odisha adults
PANCHLA NABA JAGARAN WELFARE SOCIETY,education and research rural west bengal ngos
Parhit Sewa,social services urban rural bihar adults
Paripurnata,social services urban rural west bengal adults
Parivartana Foundation for Humanity & Welfare (PFHW),education and research rural telangana students teachers youth
Parivesh Purn Jagran Sansthan,social services urban rural bihar adolescents artisans children dalits domestic workers farmers farm labourers girl child juvenile orphans plants rural poor students teachers tribals women youth
Pragati Nalanda Seva Sansthan,social services urban rural bihar adults
PRAGATI YUBA CHAKRA,social services urban rural odisha adults
PRAGATIPATHE,social services urban rural odisha adults children women youth
PRIYA PRASHIKSHAN SANSTHAN,social services urban rural rajasthan artisans artists children plants youth
"RAJINDRA EDUCATIONAL, WELFARE AND RESEARCH TRUST",education and research urban rural jammu and kashmir adults children dalits displaced persons domestic workers factory workers girl child healthcare workers hiv legal workers medical practioners migrants ngos orphans patients physically challenged rural poor sportspersons street children students teachers urban poor volunteers women youth
Rameshwaram Trust,social services urban rural all india blood donors children homeless youth
RARIAL PRIMARY EDUCATION SOCIETY,social services urban rural west bengal adults
Reaching Sky Foundation,education and research urban rural delhi adolescents adults children girl child juvenile rural poor slum dwellers street children students teachers urban poor volunteers women youth
Redix Information Social Education Society,social services urban rural all india adolescents adults artisans artists blood donors children chronically ill commercial sex workers construction workers dalits displaced persons elderly factory workers farmers farm labourers freedom fighters girl child healthcare workers hiv mentally challenged migrants ngos physically challenged plants rural poor street children students teachers tribals truckers urban poor women youth
Resources Development Institution,social services urban rural assam adults children women youth
Roopavan,social services urban rural odisha adults
Rural & Urban Development Of India (RUDI),health urban rural west bengal adults children women youth
RURAL ORGANISATION FOR SOCIAL AND EDUCATION TRUST (ROSE TRUST),social services urban rural tamil nadu adults
RUSS FOUNDATION,social services urban rural tamil nadu children women
SABARAMATI SAMITI,social services urban rural odisha children dalits disaster affected elderly farmers farm labourers rural poor salt workers scavengers human slum dwellers tribals women
SAHAYA,social services rural odisha adolescents children girl child rural poor students volunteers women youth
Sai Pratishthan,social services rural maharashtra adolescents adults children domestic workers girl child healthcare workers hiv migrants women
SAMRIDH NAV BHARAT,social services urban rural jharkhand adults
SAMTA KENDRA,social services urban rural all india blood donors children dalits girl child legal workers ngos orphans rickshawallahs drivers rural poor slum dwellers street children students urban poor women youth
SANJAY RAMNIWAS VINOD WELFARE SOCIETY,education and research urban rural uttar pradesh children girl child rural poor youth
SANKALP GRAMIN VIKAS SANSTHAN GUNPUR,environment urban rural rajasthan adolescents animals birds children construction workers dalits disaster affected domestic workers factory workers farmers farm labourers healthcare workers hiv medical practioners ngos patients plants prisoners rural poor street children students tribals urban poor volunteers women youth
SANSKAR,social services urban rural jharkhand adults
Senior Citizens Bangalore,education and research urban rural karnataka children rural poor
Shakthi,social services urban rural karnataka adults
SHISHU SHIKSHA SADAN EVAM PRIMARY PATHSHALA,education and research urban rural uttar pradesh children students youth
SHIVAM SANSTHAN,social services rural uttar pradesh adults children women youth
Shree Samarth Vishwa Prabata bahuudeshiya Sewabhavi Sanstha,social services rural maharashtra artisans artists children chronically ill elderly girl child healthcare workers hiv students women youth
SHRI G B SATPUTE SC/ST FOUNDATION,social services urban rural karnataka children girl child students
SOCIETY FOR RURAL DEVELOPMENT,social services urban rural bihar adults
Socio Research & Reform Foundation (NGO),social services urban rural delhi adults beggars children dalits elderly ethnic groups girl child ngos women youth
SRI JAGANNATH RURAL DEVELOPMENT ORGANISATION,social services urban rural odisha adults
SRI SAKTHI WOMEN DEVELOPMENT TRUST,social services rural tamil nadu dalits farmers farm labourers medical practioners plants rural poor
Suryoday Ekta Mandal,social services urban rural maharashtra adults children women youth
SUSHILA RANI WELFARE SOCIETY,health urban rural rajasthan adolescents women
"TRINITY CHARITABLE TRUST FOR HEALTH AND EDUCATION AND SOCIAL WELFARE, JAMNAGAR",social services urban rural all india adolescents adults dalits farmers farm labourers patients rickshawallahs drivers rural poor slum dwellers tribals urban poor youth
UGAM EDUCATION FOUNDATION,education and research rural jharkhand children teachers
Uttarpara Sangeet Chakra,culture and recreation urban rural west bengal artists children youth
Veena,social services urban rural jharkhand adults
Vikash Jyoti,social services urban rural bihar adults
VISHAL FOUNDATION,social services urban rural all india adults blood donors children dalits girl child hiv ngos organ donors orphans patients rickshawallahs drivers rural poor slum dwellers sportspersons street children students teachers tribals urban poor women youth
VISHWA BANDHU,social services urban rural bihar adults
VOC RURAL DEVELOPMENT CENTRE,social services rural tamil nadu adolescents commercial sex workers dalits farmers farm labourers girl child hiv street children students women
VOLUNTARY AGENCY FOR SOCIAL ACTION (VASA),social services urban rural odisha adults children farmers farm labourers girl child healthcare workers students teachers tribals women youth
AAKRITI SERV SEVA,social services urban rural bihar adults
AAROGYAA FOUNDATION FOR HEALTH PROMOTION AND COMMUNITY BASED REHABILITATION,health urban rural bihar children mentally challenged physically challenged women
ABHINAV ORISSA,social services urban rural odisha adults
ANUSANDHAN SHIKSHA EVAM SAMAJIK SAMITI,education and research urban rural madhya pradesh rural poor street children students tribals urban poor volunteers women youth
APEKSHA,social services urban rural jharkhand adults
Arputham Trust,social services rural tamil nadu children
ASHOKA BAHUUDDESHIYA SEWABHAVI SANSTHA,social services urban rural maharashtra youth
ASHRAYA,social services rural odisha children women
ATMA KRUSHAK PARISAD,social services urban rural odisha adults
Behala14 No Welfare Society,social services urban rural west bengal homeless physically challenged rickshawallahs drivers street children urban poor
Bolangir Bikash Parishad,social services urban rural odisha adults
C. P. S. TRUST,education and research urban rural jharkhand adults beggars children dalits displaced persons elderly farmers farm labourers girl child physically challenged rural poor street children students tribals urban poor women youth
Charity Foundation for Children and Aging,social services urban rural all india beggars children dalits disaster affected domestic workers elderly factory workers farmers farm labourers girl child hiv migrants orphans prisoners refugees rural poor slum dwellers street children students urban poor volunteers women youth
Council of Social Action (COSA),social services urban rural odisha adults
Dilshad Educational Society,education and research urban maharashtra street children students
Discover A New Dawn (D.A.N.D),social services urban rural west bengal adults youth
Dr.Baba Saheb Ambedkar Shatamanotsava Samiti Trust,social services rural karnataka adults children students women youth
Forum for Rural Environment and Economic Development (FREED),social services rural kerala children women
GARIA SATHI,health rural west bengal children
Gram Praudyogik Vikas Sansthan,social services urban rural bihar adults
Gram Utthan,social services urban rural odisha adults
Grama Pengal Munnetra Sangam,social services urban rural tamil nadu adults children farmers farm labourers girl child hiv ngos orphans patients physically challenged rural poor students women youth
GRAMIN MAHILA EVAM BAL UTTHAN SEVA SAMITI,social services urban rural uttar pradesh girl child women
GRAMIN VIKAS GRAMROJGAR YUVA BAHUUDESHIYAMANDAL,social services rural maharashtra ngos rural poor
Hina Mahila Utthan Samiti,social services urban rural uttar pradesh adults children women youth
Institute of Magic and Allied Arts,culture and recreation urban rural karnataka children youth
INTEGRATED RURAL WOMEN WELFARE DEVELOPMENT PROTECTIVE SOCIETY,social services rural tamil nadu adults animal lovers animals birds armed forces artisans beggars blood donors children construction workers dalits disaster affected displaced persons domestic workers girl child healthcare workers hiv homeless legal workers ngos organ donors orphans physically challenged porters prisoners refugees rural poor scavengers human slum dwellers street children tribals urban poor volunteers women youth
JANA SWASTHYA SEVA SANSTHA (JSSS),health rural odisha adolescents adults
Janhit,social services urban rural odisha adults
JOYGRAM SOCIAL WELFARE SOCIETY,education and research rural west bengal children physically challenged
Kalpana Rashmi Kalaloka,social services rural karnataka children
KHALISADY ANUBHAB WELFARE ASSOCIATION,social services rural west bengal adolescents children women
KRANTI GRAM VIKAS SANSTHA KOLPIMPRI,social services rural maharashtra children ngos youth
Kruti,social services urban rural odisha adults
Lok Seva Samiti,social services urban rural rajasthan adults
Maitreeban Seba Sangha,social services urban rural jharkhand adults
Medinipur Shilpi Chakra,social services urban rural west bengal adults
MITO,social services rural odisha adults women
Nanubhai Educational Foundation,education and research urban rural gujarat dalits rural poor students tribals
NAVAJYOTI,social services urban rural odisha adults
New Alipur Suchetana Welfare Society,social services rural west bengal girl child women
Nyaya Sahayak Samity,social services rural odisha rural poor tribals
PANCHAJANYA WELFARE SOCIETY,social services urban rural odisha adults
Parichaya,social services urban rural odisha adults
Prabhat Sansthan Dholpur,social services rural rajasthan children women
Pragati Samaj,social services urban rural odisha adults
PRAKALPA,social services urban rural odisha adults
PRITAM FOUNDATION,law advocacy and politics urban rural all india accident victims adults children dalits domestic workers factory workers girl child legal workers ngos rickshawallahs drivers rural poor street children students teachers tribals urban poor volunteers women youth
PUSPANJALI CULTURAL ASSOCIATION,social services urban rural odisha adults
RASHMI,social services urban rural odisha adults
Routes 2 Roots,culture and recreation urban rural all india artisans artists children street children students teachers volunteers youth
RURAL AND URBAN DEVELOPMENT AEGIS FOUNDATION,social services urban rural maharashtra adults children women youth
SAAD FOUNDATION,health urban rural all india children
SABRI BULBUL DILSHAD ALI TRUST,education and research urban rural all india blood donors children construction workers domestic workers factory workers farmers farm labourers firemen freedom fighters girl child healthcare workers hiv ngos organ donors street children students teachers women youth
SADHANA RAICHUR,health urban rural karnataka children women
Sahanubhuti,social services urban rural odisha adults
SANJUKTA YUBA SANGATHAN,social services urban rural odisha adults
SANKALPA,social services urban rural odisha adults
Sansar,social services urban rural odisha children women
SARVODAY MULTIPURPOSE COMMUNITY DEVELOPMENT SOCIETY,social services rural maharashtra children youth
SEARCH FOUNDATION,social services rural maharashtra disaster affected factory workers farmers farm labourers migrants rural poor students teachers women youth
Selvi Women Education and Empowerment Trust (SWEET),education and research rural tamil nadu women
SHAKSIWORLD ASSOCIATION CHARITABLE TRUST,education and research urban rural all india adults children
SHANTI BHAVAN EDUCATIONAL TRUST,education and research rural karnataka children dalits girl child orphans students
Shree Nakalangi Girnari Ashram,social services rural gujarat children
SHRINATH ACUPRESSURE SHODH SANSTHAN,social services urban rural rajasthan children women
Shrine Velankanni Mahalir Sangam,social services rural tamil nadu accident victims animal lovers
SIDDHARTH BHARTIYA GRAMIN VIKAS SANSTHAN,social services urban rural uttar pradesh children farmers farm labourers youth
SINTAM,social services urban rural odisha adults
SKS Trust,social services rural tamil nadu adults children
SOCIAL AWARNESS AND VOLUNTARY EDUCATION (SAVE) MICHEALPALAYAM,social services urban rural tamil nadu adolescents adults children domestic workers factory workers girl child migrants ngos rural poor street children women youth
SOCIAL DISASTER MITIGATION CENTRE (SDMC),social services urban rural odisha adults
South (24PG) Network of People Living With HIV/ AIDS,social services urban rural west bengal adolescents adults beggars blood donors children commercial sex workers construction workers domestic workers elderly factory workers girl child hiv homeless juvenile lesbian gays bisexuals transgender migrants orphans patients women
SRI MANJUNATH EDUCATION AND DEVELOPMENT SOCIETY,social services urban karnataka children women
Srima Dhyana Mandir,social services urban rural odisha adults
SUVARNA KARNATAKA INTEGRATED RURAL DEVELOPMENT SOCIETY,education and research urban rural karnataka adolescents adults animal lovers artists children dalits displaced persons domestic workers elderly factory workers farmers farm labourers freedom fighters girl child healthcare workers hiv homeless juvenile legal workers medical practioners mentally challenged ngos organ donors orphans patients physically challenged plants policemen porters rickshawallahs drivers rural poor scavengers human slum dwellers sportspersons street children students teachers truckers urban poor volunteers women youth
Telangana Jagruthi,development and housing urban rural telangana adolescents adults artisans artists children dalits farmers farm labourers girl child healthcare workers mentally challenged ngos physically challenged rural poor sportspersons students teachers tribals urban poor volunteers weavers women youth
United Social Welfare Association,education and research urban rural all india accident victims adults beggars blood donors children chronically ill displaced persons domestic workers elderly farmers farm labourers firemen girl child healthcare workers hiv homeless legal workers medical practioners mentally challenged ngos orphans physically challenged policemen rickshawallahs drivers slum dwellers street children students teachers tribals urban poor volunteers war victims women youth
Vidya Niketan,social services urban rural jharkhand adults
Vikash Kendra,social services urban rural jharkhand adults
Vivekananda Seva Sansad,social services urban rural odisha adults
VOLUNTARY INSTITUTION FOR THE DEVELOPMENT OF HEALTH AND YOUTH ACTIVITIES (VIDHYA),health urban rural karnataka adolescents adults children dalits farmers farm labourers girl child healthcare workers rural poor slum dwellers street children students urban poor women youth
WOMEN HEALTH EDUCATION AND AGRICULTURE DEVELOPMENT TRUST (WHEAD),social services rural tamil nadu children women
Y4D Foundation,social services urban rural all india adults children students volunteers women youth
YOUTH BRIGADE WELFARE SOCIETY,social services urban rural jammu and kashmir youth
Born 2 Win (Social Welfare Trust),social services urban tamil nadu adults commercial sex workers dalits hiv lesbian gays bisexuals transgender students women youth
