Name,Description
National Institute of Women Child & Youth Development,social services urban rural chhattisgarh adolescents adults children dalits disaster affected elderly girl child juvenile ngos slum dwellers tribals urban poor women youth
"Nirman Sanstha, Khandel",social services rural rajasthan adolescents adults children rural poor street children women
PRAYAS KENDRA SANSTHA HARSOLI,social services urban rural rajasthan adults children dalits rural poor urban poor women
PRIYADARSINI MAHILA MANDALI VADLAMANNADU,social services urban rural andhra pradesh girl child women
PROTECT,social services rural andhra pradesh adults children elderly farmers farm labourers rural poor street children students teachers
RAINBOW MANAV UTTHAN SAMITI,social services urban rural uttar pradesh adults animal lovers animals birds children disaster affected elderly farmers farm labourers girl child healthcare workers hiv mentally challenged patients physically challenged plants sportspersons street children students women youth
Rasikashray Sanskrutik Kala Va Bahuuddeshiya Sanstha,social services urban rural maharashtra adolescents children farmers farm labourers mentally challenged physically challenged rural poor tribals women youth
Root Institute for Wisdom Culture Charitable Trust,social services rural bihar adolescents adults children chronically ill hiv patients rural poor
RURAL DEVELOPMENT AND DIVINE GOOD LIFE CHARITABLE TRUST,social services urban rural tamil nadu accident victims adults blood donors children dalits elderly ethnic groups farmers farm labourers girl child healthcare workers hiv medical practioners mentally challenged ngos orphans patients physically challenged plants street children students teachers women youth
SAJAG FOUNDATION (NGO),social services urban delhi adolescents adults children elderly street children women youth
SAMA SAMAJA MANDALI,social services rural andhra pradesh adults students women youth
SBBM SOCIAL FOUNDATION NAGPUR,social services urban rural andaman and nicobar islands accident victims adolescents adults animal lovers animals birds blood donors children domestic workers farmers farm labourers freedom fighters girl child healthcare workers hiv homeless lesbian gays bisexuals transgender mentally challenged migrants ngos organ donors orphans patients physically challenged plants refugees rural poor slum dwellers sportspersons street children students tribals urban poor volunteers weavers women youth
Shamim Bahuddeshiya Mahila Sanstha,social services rural maharashtra adults girl child women
Shree Bidada Sarvodaya Trust,health urban rural gujarat accident victims adolescents adults blood donors children chronically ill elderly girl child healthcare workers hiv juvenile medical practioners mentally challenged orphans patients physically challenged rural poor street children students urban poor war victims women youth
SHRI KRISHNA EDUCATION AND WELFARE SOCIETY,social services rural madhya pradesh accident victims adolescents
Shri Utkarsh Khadi Gramodhyog Seva Trust,social services rural gujarat children girl child street children students teachers women youth
Shri Vivekanand Research And Training Institute,social services rural gujarat children farmers farm labourers girl child healthcare workers patients physically challenged rural poor street children students women youth
Shyam Lal Foundation,health rural delhi accident victims blood donors children chronically ill girl child healthcare workers medical practioners patients street children women youth
SKILLS FOR INDIA,education and research urban rural all india adults construction workers dalits domestic workers factory workers farmers farm labourers healthcare workers physically challenged rickshawallahs drivers rural poor slum dwellers tribals truckers urban poor weavers women youth
SMT. BASANTI DEVI MEMORIAL EDUCATION AND DEVELOPMENT SAMITI NEEM KA THANA,social services rural rajasthan adults blood donors children chronically ill elderly girl child healthcare workers hiv medical practioners mentally challenged orphans patients physically challenged street children students women youth
"Social Association for Welfare,Education & Rural Awareness",social services urban rural delhi adults animal lovers animals birds children chronically ill hiv street children women youth
Social Health Awareness & Public Enhancement Society (SHAPES),social services rural jharkhand girl child healthcare workers hiv plants street children students women youth
SOCIAL ORGANIZATION FOR COMMUNITY HELP,social services rural delhi adults children dalits rural poor salt workers slum dwellers students women youth
"SOCIETY FOR WELFARE ADMINISTRATION, MANAGEMENT EDUCATION AND VOCATION(SWAMEV)",social services rural delhi accident victims adolescents adults artisans artists beggars blood donors children commercial sex workers construction workers disaster affected displaced persons domestic workers elderly factory workers farmers farm labourers firemen girl child healthcare workers juvenile legal workers lesbian gays bisexuals transgender orphans patients physically challenged policemen porters prisoners rickshawallahs drivers rural poor salt workers scavengers human slum dwellers sportspersons street children students urban poor war victims weavers women youth
Society for Women Education Environment and Training(SWEET),health rural andhra pradesh adolescents adults children dalits elderly farmers farm labourers girl child healthcare workers hiv juvenile migrants ngos patients physically challenged plants rural poor street children students tribals volunteers women youth
SOCIETY OF TRIBAL WOMEN FOR DEVELOPMENT,social services rural all india girl child tribals women
Somling Gram Vikas Mandal,social services rural maharashtra adults rural poor street children students teachers women youth
St. Xavier's Non-Formal Education Society,education and research urban rural gujarat children construction workers dalits homeless legal workers migrants slum dwellers tribals urban poor volunteers women youth
SURYA JYOTHI YOGA VEDANTA SADHANA GURUKULAM,culture and recreation urban rural karnataka artists elderly orphans rural poor students
SUSHILA FOUNDATION,education and research urban rural all india animals birds beggars children disaster affected displaced persons girl child mentally challenged orphans physically challenged plants rural poor slum dwellers sportspersons street children students teachers urban poor volunteers women youth
THE FULL GOSPEL TRUST OF INDIA,social services urban rural all india adolescents adults children girl child hiv rural poor women youth
The Young Citizen of India Charitable Trust,social services urban rural gujarat adolescents farmers farm labourers girl child healthcare workers rural poor students teachers tribals urban poor volunteers women youth
UNDER PRIVILEGED ADVANCEMENT BY YOUTH SOCIETY BHANDARA,education and research rural maharashtra adolescents children girl child street children students youth
VARAIYA KRISHI BAGVANI EVAM JAN KALYAN SAMITI AMOL(PATHA),social services rural madhya pradesh adolescents adults girl child healthcare workers hiv mentally challenged physically challenged rural poor street children students tribals women
VENKATAPATI RAJU EDUCATIONAL SOCIETY-Gavaravaram,education and research rural andhra pradesh students teachers tribals youth
VIDYARTHI SAHAYYAK SAMITI WARORA,education and research urban rural maharashtra children girl child rural poor students tribals youth
Vivekananda Innovations for Developing Youth Ambitions Foundations (Vidya Foundations),social services rural andhra pradesh adolescents children domestic workers girl child juvenile ngos rural poor street children students tribals volunteers weavers women youth
Voice Society,law advocacy and politics urban rural all india adolescents adults women youth
Yoganjali Kelvani Mandal,social services rural gujarat girl child healthcare workers hiv homeless medical practioners mentally challenged ngos patients physically challenged plants rural poor street children students teachers volunteers women youth
AAJEEVIKA EDUCATIONAL TRAINING FOUNDATION,education and research urban rural madhya pradesh children construction workers domestic workers mentally challenged migrants ngos organ donors orphans patients plants rural poor students teachers tribals urban poor volunteers weavers women youth
AASHISH FOUNDATION,social services urban rural bihar artisans artists beggars construction workers domestic workers factory workers farmers farm labourers firemen homeless orphans porters prisoners refugees rural poor salt workers scavengers human slum dwellers street children tribals truckers urban poor weavers
Abhiyan Sahibganj,social services urban rural jharkhand adults girl child street children women youth
ABHYAAS FOUNDATION,social services urban rural bihar adolescents adults children domestic workers elderly patients rural poor slum dwellers street children students urban poor women youth
Action for Protection of Wild Animals(APOWA),environment urban rural odisha animal lovers animals birds artisans disaster affected farmers farm labourers rural poor
"ADARSH SARVJANIK TRUST, MOVASA",education and research urban rural gujarat adults
ADDRES CENTRE,social services rural tamil nadu adults
ADVANCE INFORMATION MANAGEMENT SOCIETY,social services rural madhya pradesh adults
AHMADPUR SPORTS COMPLEX,social services rural west bengal rural poor
Akikrat Samajik Suraksha Chetna Sansthan,social services urban rural all india adolescents adults artisans children disaster affected domestic workers farmers farm labourers girl child mentally challenged ngos physically challenged rural poor slum dwellers street children students teachers tribals urban poor volunteers women youth
AL MADINA MUSLIM EDUCATION AND CULTURAL ASSOCIATION,social services rural andhra pradesh adults women
ALAKH SAMITI,social services rural madhya pradesh adults elderly women
ALAKNANDA GHATI SHILPI FEDERATION,social services urban rural uttarakhand animals birds artisans beggars children chronically ill construction workers dalits disaster affected displaced persons factory workers farmers farm labourers girl child healthcare workers juvenile legal workers mentally challenged migrants ngos plants policemen porters prisoners rickshawallahs drivers slum dwellers street children students urban poor volunteers women youth
ALFA EDUCATIONAL SOCIETY,social services rural rajasthan artists youth
ANCHALIKA LOK-KALYAN KENDRA,social services rural odisha adolescents children dalits disaster affected elderly farmers farm labourers girl child physically challenged rural poor
ANKUR YUVA CHETNA SHIVIR,social services urban rural bihar adults children construction workers domestic workers factory workers girl child healthcare workers hiv homeless juvenile migrants ngos orphans rural poor slum dwellers street children students teachers urban poor volunteers women youth
Anupam Mahila Chetna Samiti,social services rural jharkhand girl child women
ARNOLD EDUCATIONAL AND RURAL DEVELOPMENT SOCIETY,education and research urban rural andhra pradesh adolescents children students youth
ASHOK SANSTHAN,social services rural uttar pradesh adults artisans beggars children construction workers dalits disaster affected domestic workers elderly ethnic groups farmers farm labourers freedom fighters girl child healthcare workers homeless medical practioners ngos patients plants porters prisoners rickshawallahs drivers rural poor scavengers human street children students teachers tribals volunteers weavers women youth
ASHRAMPARA KRISHNA SOCIAL WELFARE ORGANISATION,social services urban andaman and nicobar islands children girl child
Association for Peoples Initiative for Liberation,social services urban rural west bengal adolescents adults artisans children farmers farm labourers girl child hiv homeless street children tribals urban poor women youth
BADLAO INSTITUTE OF TRAINING AND MANAGMENT,education and research urban rural jharkhand dalits farmers farm labourers ngos rural poor students tribals urban poor volunteers women youth
BAGARIA RELIEF WELFARE AMBULANCE SOCIETY,social services rural west bengal children women
BALITIKURI BIKASH BHABAN,social services rural west bengal adolescents adults blood donors children elderly girl child healthcare workers juvenile mentally challenged orphans patients physically challenged street children students youth
BASIRHAT FAMILY PLANNING WELFARE CENTRE,social services rural west bengal adults children dalits girl child healthcare workers patients students women youth
BETHUADAHARI INSTITUTE FOR MOTHER & CHILD CARE,social services rural west bengal children dalits women
BHADRAPUR PEOPLES RELIEF WELFARE COMMITTEE,social services rural west bengal adults children elderly girl child rural poor street children youth
BHAGINI NIVEDITA SHIKSHA SAMITI,social services urban rural all india adults children elderly girl child students women youth
"Birati Society For Human, Educational And Environmental Development",social services urban rural west bengal adults elderly girl child healthcare workers students women youth
Biswagyana Chetana Samaja,health rural odisha adults
Bundel Khand Sewa Sansthan,social services rural madhya pradesh adults blood donors children dalits disaster affected farmers farm labourers girl child healthcare workers hiv homeless ngos plants rural poor students teachers tribals women youth
CARING SOULS FOUNDATION,social services urban rural andhra pradesh healthcare workers hiv patients students teachers
Centre for Development Education and Communications,education and research urban rural tamil nadu adults children elderly women
Centre for Development Service,social services rural odisha adults children disaster affected farmers farm labourers rural poor students tribals volunteers women youth
Centre for Promotion of Social Concerns,social services urban rural tamil nadu adults children dalits disaster affected girl child legal workers medical practioners ngos physically challenged students teachers volunteers women youth
CHERRY BLOSSOMS SOCIETY,social services urban rural nagaland adolescents children elderly girl child mentally challenged ngos physically challenged rural poor street children students teachers volunteers women youth
CHINGRA THAKURANICHAK BALAK SANGHA,education and research rural west bengal children girl child students youth
CHRIST ORPHAN CENTER MINISTRIES (COCM),social services urban rural andhra pradesh adults women
CHUANPUR SAPTAPARNI,social services rural west bengal adults children dalits elderly girl child healthcare workers students women youth
Creation Welfare Society,social services urban rural bihar adolescents adults dalits farmers farm labourers rural poor women youth
CREATIVE ACTION FOR NECESSITOUS DEVELOPMENT FROM LIVING ENVIRONMENTS (CANDLE),social services urban rural all india children women youth
Creative Social Educational and Economical Development Society (CRE-SEEDS),social services rural andhra pradesh adolescents adults children elderly women youth
DALIT MAHILA JAN KALYAN SANSTHAN,social services rural bihar dalits women
DALIT SANGAM SAMITI,social services rural bihar adults dalits women youth
DEVELOPMENT OF INTEGRATED NURTURING ASSOCIATION TO KINDLE AWAKENING FOR RENAISSANCE,social services rural andhra pradesh factory workers farmers farm labourers
Devi Convent School Educational Society,social services rural andhra pradesh children dalits farmers farm labourers rural poor women
DEWANCHAL WELFARE SOCIETY,social services rural madhya pradesh adults
DHANWANTARI MEDICAL TRUST,health urban rural maharashtra adolescents adults blood donors children chronically ill disaster affected girl child patients tribals
Disha Sewa Sansthan,education and research urban rural all india adults children domestic workers factory workers farmers farm labourers girl child healthcare workers ngos physically challenged plants rural poor street children students teachers urban poor volunteers women youth
DR.K.R.ADHIKARY COLLEGE OF OPTOMETRY AND PARAMEDICAL TECHNOLOGY,social services urban rural west bengal adults dalits elderly girl child hiv mentally challenged physically challenged rural poor slum dwellers street children students women youth
Effort(Eco Foundation for research & training),education and research rural andhra pradesh dalits tribals women
Emerge India Foundation,philanthropic intermediaries and voluntarism promotion urban rural all india accident victims adolescents adults animal lovers animals birds armed forces artisans artists beggars blood donors children chronically ill commercial sex workers construction workers dalits disaster affected displaced persons domestic workers elderly factory workers farmers farm labourers firemen freedom fighters girl child healthcare workers hiv homeless juvenile legal workers lesbian gays bisexuals transgender medical practioners mentally challenged migrants ngos organ donors orphans patients physically challenged plants policemen porters prisoners refugees rickshawallahs drivers rural poor salt workers scavengers human slum dwellers sportspersons street children students teachers tribals truckers urban poor volunteers war victims weavers women youth
END POVERTY,social services rural bihar adolescents adults artisans farmers farm labourers girl child ngos rural poor slum dwellers students tribals urban poor volunteers women youth
Exalt Education And Welfare Society,social services urban rural all india adults children construction workers ngos rural poor students women youth
FOSTER BHARTIYA PARYAVARAN SOCIETY INTALI,social services urban rural rajasthan adults children
GALSI RURAL EDUCATIONAL SOCIETY,social services rural west bengal adults street children students women youth
Gheedah Titumir Gram Vikash Kendra,social services rural west bengal children women
Global Social And Welfare Foundation,social services urban rural andhra pradesh accident victims adults artists beggars blood donors children dalits farmers farm labourers firemen girl child healthcare workers hiv homeless legal workers mentally challenged ngos orphans patients physically challenged refugees rural poor slum dwellers sportspersons street children students teachers tribals urban poor volunteers women youth
GOSPEL VISION MISSION,social services urban rural tamil nadu adults children elderly girl child women youth
Grace Welfare Society,social services rural west bengal adolescents children street children students youth
GRAMA VALARCHI,education and research urban rural tamil nadu children girl child students
Grameen Va Samajik Vikas Sanstha,social services urban rural rajasthan accident victims adolescents adults animal lovers animals birds beggars children chronically ill construction workers dalits factory workers farmers farm labourers girl child juvenile migrants rural poor street children urban poor volunteers women youth
GUILD OF SERVICE (SEVA SAMAJAM) COIMBATORE,education and research rural tamil nadu children
Gunjan,health urban rural chandigarh adolescents adults children commercial sex workers disaster affected displaced persons domestic workers elderly girl child healthcare workers hiv homeless juvenile legal workers lesbian gays bisexuals transgender medical practioners mentally challenged ngos orphans patients physically challenged rickshawallahs drivers street children students teachers truckers urban poor volunteers women youth
HARIPUR AMRA SABAI UNNAYAN SAMITI,social services rural west bengal adults children farmers farm labourers girl child healthcare workers hiv students teachers women
Haripur Women Help Society,social services rural west bengal women
HOPE PUBLIC CHARITABLE TRUST(A unit of Social and Educational welfare trust),health urban rural tamil nadu children mentally challenged
Ichamati Society for Human Welfare and Relations,social services rural west bengal women
Ichapur BrahmanPara Silpa Niketan,social services urban rural west bengal adolescents adults children dalits elderly girl child hiv patients tribals women youth
ICHAPUR SOCIETY FOR THE WOMENS OWN IMAGE,social services urban rural west bengal adolescents children girl child healthcare workers ngos slum dwellers students tribals women youth
Indian Institute of Education and Care(IIEC),social services urban rural odisha children elderly girl child rural poor students women youth
INDIAN INSTITUTE OF SOCIAL DEVELOPMENT,social services rural madhya pradesh adults
INDO-INTERNATIONAL CHRISTIAN CHAMBER OF COMMERCE,business and professional associations unions rural tamil nadu adults
Institute of Social Development,social services urban rural uttarakhand adults animals birds children chronically ill elderly farmers farm labourers girl child healthcare workers hiv plants women youth
INTEGRATED DEVELOPMENT ORGANISATION,environment rural madhya pradesh adults
Itarai Asha Deep,social services urban rural west bengal adolescents adults children elderly girl child women youth
Jagabandhu Jarashram,social services urban rural odisha adults beggars blood donors children dalits disaster affected displaced persons elderly ethnic groups girl child healthcare workers hiv homeless juvenile mentally challenged migrants ngos organ donors orphans patients physically challenged plants porters rickshawallahs drivers rural poor scavengers human slum dwellers street children students tribals urban poor volunteers war victims weavers women youth
JAMUI VIKLANG SEVA SAMITI,social services urban rural bihar adults children elderly women youth
Jan Sahyog Kendra (J.S.K),social services urban rural jharkhand adults children students women youth
JAN SEVA KALYAN KENDRA,social services rural bihar adults children women youth
JEEVAN DEEP KALYAN SANSTHAN,social services rural bihar children ngos salt workers
"Jeevodaya Society, Itarsi",social services urban rural madhya pradesh children girl child homeless juvenile orphans street children women
JYOTI SEVA SADAN,social services urban rural bihar adults children women youth
La Martiniere SEOMP Society,social services urban rural west bengal adolescents adults women youth
LABPUR JEEVAN JANAKALYAN SOCIETY,social services urban rural west bengal adolescents adults beggars blood donors children disaster affected healthcare workers homeless medical practioners mentally challenged ngos physically challenged plants rickshawallahs drivers rural poor sportspersons street children students teachers urban poor volunteers women youth
Lake Gardens Saha Education Society,education and research urban west bengal adolescents children girl child students teachers youth
LEADING LIGHT INTERNATIONAL (LLI),social services urban rural tamil nadu children women
Lok Jan Seva Kendra,health rural jharkhand beggars blood donors children domestic workers farmers farm labourers girl child healthcare workers hiv patients physically challenged plants rickshawallahs drivers rural poor street children students tribals urban poor women
LYNY SOCIETY,social services rural andhra pradesh children hiv mentally challenged patients physically challenged street children students women youth
Maa Jayachandi Saririka Akshyam Seva Centre,education and research urban rural odisha children girl child students
MADHYA PRADESH VIGYAN SABHA,development and housing rural madhya pradesh adults
Maharashtra Advance Training Center,social services urban rural all india adults blood donors children dalits displaced persons girl child ngos physically challenged rickshawallahs drivers rural poor students teachers tribals women youth
MAHILA GRAMODYOG SEVA SAMITI,health urban rural uttar pradesh adolescents adults children dalits girl child rural poor urban poor women youth
MAHILA MUKTI SANSTHA,social services urban rural jharkhand accident victims adolescents children dalits disaster affected juvenile legal workers medical practioners mentally challenged migrants ngos physically challenged plants policemen street children students teachers tribals volunteers women youth
Mallarpur Purvanchal Manav Seva Kendra,social services rural west bengal healthcare workers students
MANAB KALYAN,social services rural assam adults
Manav Kalyan Kendra Dumka,social services urban rural jharkhand adults children elderly women youth
Manickpur Chaitali Sangha,social services urban rural west bengal children street children students
`Manjula Cultural Trust' (MA.C.T) (Manjula Kalanidhi),social services rural andhra pradesh elderly
Manthan The Achievement,social services urban rural west bengal adults children girl child patients refugees rural poor slum dwellers students women youth
Maruti Sewa Samiti Udaipur,social services urban rural rajasthan adults children
Matia Humanity Association of Nation,social services urban rural west bengal adults children elderly farmers farm labourers women youth
MAYUREWAR AMBEDKAR SMRITI SANGHA,social services rural west bengal displaced persons mentally challenged physically challenged
Midnapur Progressive SC/ST/ Minority Dev. Association,social services urban rural west bengal children dalits orphans physically challenged rural poor slum dwellers students tribals urban poor women
MODERN GRAMOUDHYOG SEWA SANSTHAN,social services urban rural uttar pradesh ngos
"MOTHER TERESA JAN KALYAN KENDRA, GAYA",social services rural bihar adults children elderly rural poor women
Narendrapur Rural Movement And Development Society,education and research rural west bengal adults
National Education Is Essential for Womens Society (NEEWS),health urban rural odisha adolescents adults children girl child rural poor
National Institute of Professional Education and Technology (NIPET),education and research rural odisha refugees rural poor scavengers human slum dwellers street children students teachers tribals urban poor youth
NATIONAL INTEGRATED HUMAN & INDUSTRIAL DEVELOPMENT AGENCY(NIHIDA),social services rural odisha adults street children students women youth
